<!DOCTYPE ROOT SYSTEM "FrmWrk_Servlet.dtd">
<ROOT>
    <BEAN Name="beanSchemaList" Service="framework.service.SrvFindList" Class="framework.beandata.BeanFindList" Scope="request">
        <QUERY Type="QUERY">SELECT * FROM information_schema.SCHEMATA</QUERY>
    </BEAN>
    <BEAN Name="beanTableList" Service="framework.service.SrvFindList" Class="framework.beandata.BeanFindList" Scope="request">
        <PARAM Name="schema" Type="STRING"/>
        <QUERY Type="QUERY" ParameterCount="1">SELECT * FROM information_schema.TABLES WHERE TABLE_SCHEMA = ?</QUERY>
    </BEAN>
    <BEAN Name="beanColumnList" Service="framework.service.SrvFindList" Class="framework.beandata.BeanFindList" Scope="request">
        <PARAM Name="schema" Type="STRING"/>
        <PARAM Name="table" Type="STRING"/>
        <QUERY Type="QUERY" ParameterCount="1">SELECT * FROM information_schema.COLUMNS WHERE TABLE_SCHEMA = ? AND TABLE_NAME = ?</QUERY>
    </BEAN>
    <BEAN Name="beanFkColumnList" Service="framework.service.SrvFindList" Class="framework.beandata.BeanFindList" Scope="request">
        <PARAM Name="schema" Type="STRING"/>
        <PARAM Name="table" Type="STRING"/>
        <PARAM Name="column" Type="STRING"/>
        <QUERY Type="QUERY" ParameterCount="1">SELECT REFERENCED_TABLE_SCHEMA AS TABLE_SCHEMA, REFERENCED_TABLE_NAME AS TABLE_NAME, REFERENCED_COLUMN_NAME AS COLUMN_NAME FROM INFORMATION_SCHEMA.KEY_COLUMN_USAGE WHERE TABLE_SCHEMA = ? AND TABLE_NAME = ? AND COLUMN_NAME = ?</QUERY>
    </BEAN>
    <SERVLET Name="Index" Target="/Web/Page/index.jsp" Authentification="false"/>
    <SERVLET Name="Home" Target="/Web/Page/home.jsp"/>
    <SERVLET Name="HomePopup" Target="/Web/Page/home_popup.jsp"/>
    <SERVLET Name="IndexLoginValider" Target="/Web/Page/home_popup.jsp" TargetError="/Web/Page/index.jsp" Authentification="false">
        <BEAN Name="BeanAuthentification" Scope="request" Service="workspace.service.SrvIndexLoginValider">
            <PARAM Name="login" Type="STRING"/>
            <PARAM Name="password" Type="STRING"/>
        </BEAN>
    </SERVLET>
    <SERVLET Name="EditorJavaPage" Target="/Web/PageExtJs/EditorJava/Page.jsp" TargetError="/Web/Page/index.jsp">
        <BEAN Name="BeanEditorJava" Scope="request" Service="workspace.service.SrvEditorJavaPage">
            <PARAM Name="application" Type="STRING"/>
            <PARAM Name="pathToExpand" Type="STRING"/>
            <PARAM Name="FileName" Type="STRING"/>
        </BEAN>
    </SERVLET>
    <SERVLET Name="EditorJavaPageSave" Target="/Web/Page/EditorJava/Page.jsp" TargetError="/Web/Page/index.jsp">
        <BEAN Name="BeanEditorJava" Scope="request" Service="workspace.service.SrvEditorJavaValider">
            <PARAM Name="application" Type="STRING"/>
            <PARAM Name="FileEditor" Type="STRING"/>
            <PARAM Name="FileName" Type="STRING"/>
            <PARAM Name="pathToExpand" Type="STRING"/>
            <PARAM Name="navIndex" Type="STRING"/>
            <PARAM Name="navNbRow" Type="STRING"/>
        </BEAN>
    </SERVLET>
    <SERVLET Name="PageFileEditor" Target="/Web/Page/Common/PageFileEditor.jsp" TargetError="/Web/Page/index.jsp">
        <BEAN Name="BeanEditorJava" Scope="request" Service="workspace.service.SrvEditorJavaPage">
            <PARAM Name="application" Type="STRING"/>
        </BEAN>
    </SERVLET>
    <SERVLET Name="PageFileEditorValider" Target="/Web/Page/Common/PageFileEditor.jsp" TargetError="/Web/Page/index.jsp">
        <BEAN Name="BeanEditorJava" Scope="request" Service="workspace.service.SrvEditorJavaValider">
            <PARAM Name="application" Type="STRING"/>
            <PARAM Name="FileEditor" Type="STRING"/>
            <PARAM Name="FileName" Type="STRING"/>
            <PARAM Name="pathToExpand" Type="STRING"/>
            <PARAM Name="navIndex" Type="STRING"/>
            <PARAM Name="navNbRow" Type="STRING"/>
        </BEAN>
    </SERVLET>
    <SERVLET Name="EditorJavaPageNew" Target="/Web/Page/Common/PageNew.jsp" TargetError="/Web/Page/index.jsp"/>
    <SERVLET Name="EditorJavaPageNewValider" Target="/Web/Page/Common/PageNew.jsp" TargetError="/Web/Page/index.jsp">
        <BEAN Name="BeanNewFile" Scope="request" Service="workspace.service.SrvEditorJavaNew">
            <PARAM Name="application" Type="STRING"/>
            <PARAM Name="Type" Type="STRING"/>
            <PARAM Name="Path" Type="STRING"/>
            <PARAM Name="Name" Type="STRING"/>
        </BEAN>
    </SERVLET>
    <SERVLET Name="EditorJavaPageCompile" Target="/Web/Page/Common/PageCompile.jsp" TargetError="/Web/Page/index.jsp"/>
    <SERVLET Name="EditorJavaPageCompileValider" Target="/Web/Page/Common/PageCompile.jsp" TargetError="/Web/Page/index.jsp">
        <BEAN Name="BeanNewFile" Scope="request" Service="workspace.service.SrvEditorJavaCompile">
            <PARAM Name="application" Type="STRING"/>
            <PARAM Name="pathSrc" Type="STRING"/>
            <PARAM Name="pathDst" Type="STRING"/>
            <PARAM Name="type" Type="STRING"/>
        </BEAN>
    </SERVLET>
    <SERVLET Name="EditorJavaPageCompileClean" Target="/Web/Page/Common/PageMessage.jsp" TargetError="/Web/Page/index.jsp">
        <BEAN Name="BeanNewFile" Scope="request" Service="workspace.service.SrvEditorJavaCompileClean">
            <PARAM Name="application" Type="STRING"/>
            <PARAM Name="type" Type="STRING"/>
        </BEAN>
    </SERVLET>
    <SERVLET Name="EditorJavaPageCompileDirect" Target="/Web/Page/Common/PageMessage.jsp" TargetError="/Web/Page/index.jsp">
        <BEAN Name="BeanNewFile" Scope="request" Service="workspace.service.SrvEditorJavaCompile">
            <PARAM Name="application" Type="STRING"/>
            <PARAM Name="pathSrc" Type="STRING"/>
            <PARAM Name="pathDst" Type="STRING"/>
            <PARAM Name="type" Type="STRING"/>
        </BEAN>
    </SERVLET>
    <SERVLET Name="EditorJavaPageJar" Target="/Web/Page/Common/PageJar.jsp" TargetError="/Web/Page/index.jsp"/>
    <SERVLET Name="EditorJavaPageJarValider" Target="/Web/Page/Common/PageJar.jsp" TargetError="/Web/Page/index.jsp">
        <BEAN Name="BeanNewFile" Scope="request" Service="workspace.service.SrvEditorJavaPackage">
            <PARAM Name="application" Type="STRING"/>
            <PARAM Name="package" Type="STRING"/>
            <PARAM Name="type" Type="STRING"/>
        </BEAN>
    </SERVLET>
    <SERVLET Name="EditorJavaPageWar" Target="/Web/Page/Common/PageWar.jsp" TargetError="/Web/Page/index.jsp"/>
    <SERVLET Name="EditorJavaPageWarValider" Target="/Web/Page/Common/PageWar.jsp" TargetError="/Web/Page/index.jsp">
        <BEAN Name="BeanNewFile" Scope="request" Service="workspace.service.SrvEditorJavaPackage">
            <PARAM Name="application" Type="STRING"/>
            <PARAM Name="package" Type="STRING"/>
            <PARAM Name="type" Type="STRING"/>
        </BEAN>
    </SERVLET>
    <SERVLET Name="EditorJavaPageWarClean" Target="/Web/Page/Common/PageWarClean.jsp" TargetError="/Web/Page/index.jsp"/>
    <SERVLET Name="EditorJavaPageWarCleanValider" Target="/Web/Page/Common/PageWarClean.jsp" TargetError="/Web/Page/index.jsp">
        <BEAN Name="BeanNewFile" Scope="request" Service="workspace.service.SrvEditorJavaPackageClean">
            <PARAM Name="application" Type="STRING"/>
            <PARAM Name="package" Type="STRING"/>
            <PARAM Name="type" Type="STRING"/>
        </BEAN>
    </SERVLET>
    <SERVLET Name="EditorJavaPageZip" Target="/Web/Page/Common/PageZip.jsp" TargetError="/Web/Page/index.jsp"/>
    <SERVLET Name="EditorJavaPageZipValider" Target="/Web/Page/Common/PageZip.jsp" TargetError="/Web/Page/index.jsp">
        <BEAN Name="BeanNewFile" Scope="request" Service="workspace.service.SrvEditorJavaZip">
            <PARAM Name="application" Type="STRING"/>
            <PARAM Name="pathSrc" Type="STRING"/>
            <PARAM Name="pathDst" Type="STRING"/>
            <PARAM Name="fileName" Type="STRING"/>
        </BEAN>
    </SERVLET>
    <SERVLET Name="EditorJavaPageCopyMove" Target="/Web/Page/Common/PageCopyMove.jsp" TargetError="/Web/Page/index.jsp"/>
    <SERVLET Name="EditorJavaPageCopyMoveValider" Target="/Web/Page/Common/PageCopyMove.jsp" TargetError="/Web/Page/index.jsp">
        <BEAN Name="BeanCopyMove" Scope="request" Service="workspace.service.SrvEditorJavaCopyMove">
            <PARAM Name="application" Type="STRING"/>
            <PARAM Name="pathSrc" Type="STRING"/>
            <PARAM Name="pathDst" Type="STRING"/>
            <PARAM Name="nameDst" Type="STRING"/>
            <PARAM Name="operation" Type="STRING"/>
        </BEAN>
    </SERVLET>
    <SERVLET Name="EditorJavaPageXmlXsl" Target="/Web/Page/Common/PageXmlXsl.jsp" TargetError="/Web/Page/index.jsp"/>
    <SERVLET Name="EditorJavaPageXmlXslValider" Target="/Web/Page/Common/PageText.jsp" TargetError="/Web/Page/index.jsp">
        <BEAN Name="BeanXmlXsl" Scope="request" Service="workspace.service.SrvEditorJavaXmlXsl">
            <PARAM Name="application" Type="STRING"/>
            <PARAM Name="pathXml" Type="STRING"/>
            <PARAM Name="xmlName" Type="STRING"/>
            <PARAM Name="xmlScope" Type="STRING"/>
            <PARAM Name="pathXsl" Type="STRING"/>
            <PARAM Name="paramXsl" Type="STRING"/>
            <PARAM Name="xslParamName" Type="STRING"/>
            <PARAM Name="resultName" Type="STRING" Default="xmlResult"/>
        </BEAN>
    </SERVLET>
    <SERVLET Name="EditorJavaPageXmlXsl" Target="/Web/Page/Common/PageXmlXsl.jsp" TargetError="/Web/Page/index.jsp"/>
    <SERVLET Name="EditorJavaPageXmlXslValider" Target="/Web/Page/Common/PageText.jsp" TargetError="/Web/Page/index.jsp">
        <BEAN Name="BeanXmlXsl" Scope="request" Service="workspace.service.SrvEditorJavaXmlXsl">
            <PARAM Name="application" Type="STRING"/>
            <PARAM Name="pathXml" Type="STRING"/>
            <PARAM Name="xmlName" Type="STRING"/>
            <PARAM Name="xmlScope" Type="STRING"/>